,Consulting,Seed,1800000.0,,Help small businesses grow their sales via our customer interaction and growth platform.,2021,2021.0,Bangalore,"Pradeep Dodle, Nikhil Goenka","021 Capital, Sparrow Capital",,,Wasabi
,Real Estate,Series A,6000000.0,,Strata is an innovative tech-driven platform redefining Fractional Investments in Premium Commercial Real Estate,2021,2019.0,Bangalore,"Sudarshan Lodha, Priyanka Rathore","Kotak Investment Advisors Limited, Gruhas Proptech",,,Strata
,E-commerce,Seed,300000.0,,A curated online marketplace for all things sustainable!,2021,2020.0,Bangalore,Pallavi Srivastava,VANS Group,,,Ourbetterplanet
,SaaS startup,Seed,1500000.0,,"Murf AI is working on simplifying voice audio and making high-quality voice overs accessible to everyone, using artificial intelligence.",2021,2020.0,Bangalore,"Sneha Roy, Ankur Edkie, Divyanshu Pandey",Elevation Capital,,,Murf.ai
,Media,,2000000.0,,"JetSynthesys is the group's most innovative company in the promising Digital and Technology Business World with a vision to create world class digital products, platforms and services in India",2021,2014.0,Pune,Rajan navani,Sachin Tendulkar,,,JetSynthesys
,Fitness,Seed,1000000.0,,"A new age D2C health & fitness brand with a mission to deliver products that taste good, feel good and do good.",2021,2019.0,Silvassa,"Mohammad Patel, Rahil Virani",9Unicorns,,,MYFITNESS
,Healthcare,Seed,4000000.0,,"I am Love came into existence in early 2020, with the aim of redefining the relationship we have with our health.",2021,2020.0,Mumbai,Shilpa Rathi,Xentel Investments,,,I am Love
,D2C,,40000000.0,,MyGlamm is India’s fastest growing direct-to-consumer beauty brand.,2021,2015.0,Mumbai,"Darpan Sanghvi, Priyanka Gill",Accel Partners,,,MyGlamm
,IT,,1600000.0,,Gumlet has built a new-age media delivery infrastructure that provides low code or no-code integration plugins that automate the entire media publishing pipeline.,2021,2019.0,Bangalore,"Divyesh Patel, Aditya Patadia",Sequoia’s Surge,,,Gumlet
,Gaming,Pre-series A,2000000.0,,Creator-led Social Gaming & Live Streaming Platform,2021,2015.0,Bangalore,"Saurabh Pandey, Akshay Dubey","Waterbridge, Lumikai",,,Eloelo
,EdTech,Pre-series A,2000000.0,,"Edukemy is the first EdTech company in the country, in the non –STEM segment, offering an immersive learning experience to the students, supported by cutting-edge technology and an AI-based evaluation system.",2021,2020.0,Noida,Chandrahas Panigrahi,"Auxano, Falcon5",,,Edukemy
,Mobility,Pre-series A,5000000.0,,Zingbus is a renowned brand in the bus operating industry.,2021,2019.0,Gurugram,"Mratunjay, Prashant Kumar, Ravi Kumar Verma",Infoedge ventures,,,Zingbus
,Media,Seed,300000.0,,NewsReach is a Mumbai based company that wants to create a disruptive ecosystem of original and local news content.,2021,2018.0,Ahmedabad,"Soniya Kundnani, Darshan Shah",JITO Angel Network,,,NewsReach
,FinTech,Pre-seed,330000.0,,"India's first app for kids & teens to manage and spend pocket money while learning about money in a fun, gamified way.",2021,2017.0,Hyderabad,"VishwajitPureti, Ashish Singh, Pallavi Tipparaju, Viraj Gadde",Jupiter,,,Pencilton
,IT,,1000000.0,,"Bringing ease of eCommerce to Construction for builders, infrastructure companies, contractors and workers",2021,2020.0,Gurugram,"Prashant Gupta, Sridhar Sundaram",Unitus Ventures,,,Bandhoo
,IT,,53000000.0,,"AI-based travel app offering seamless planning and booking for flights, trains, buses, hotels and more!",2021,2007.0,Gurugram,"Rajnish Kumar, Aloke Bajpai","GIC, Infoedge",,,ixigo
,Food & Beverages,Series A,6000000.0,,"Believe simple, homely ingredients, minimally processed, are the secret to nutritious, tasty food",2021,2019.0,Mumbai,Shashank Mehta,Sequoia Capital,,,The Whole Truth
,Fitness,Seed,800000.0,,Mainstream fitness formats are a primitive solution to the modern problems of a sedentary lifestyle.,2021,2021.0,Bangalore,"Anurag Mundhada, Jayesh Hannurkar, Sourabh Agrawal",pi Ventures,,,Insane AI
,E-learning,Seed,,,"Trying to solve the problem of unemployment in young graduates, who, despite having college degrees, don't have the skills for the real world.",2021,2020.0,Jaipur,Kamal Kant Gupta,IAN,,,Learn4o Technology
,Automobile,,200000000.0,,"Droom is an AI and data science driven online transactional platform, which offers 21st century experience in buying & selling used & new automobiles in India",2021,2014.0,Gurugram,Sandeep Aggarwal,,,,Droom
,Environmental Services,,1000000.0,,Provide services that allow clients to understand and organize themselves around changing environment.,2021,2003.0,Noida,Yogesh Patil,"Northern Arc, Caspian Impact Investments",,,Skymet
,Consumer Services,Pre-series A,2000000.0,,Help small & medium sized businesses to grow by helping them with their shipping requirements at the cheapest and most reliable service.,2021,2019.0,Bangalore,"Shyam Kalita, Debanshu Sinha, Prayas Mittal",Kalaari Capital,,,Go Swift
,Healthcare,,50000000.0,,A brand which develops products from world-class research and attempts to solve every little problem that we as parents face.,2021,2016.0,Gurugram,"Varun Alagh, Ghazal Alagh",Sofina Ventures SA,,,Mamaearth
,D2C,Series A,36000000.0,,G.O.A.T Brand Labs provides a tech-enabled platform for D2C brands to scale.,2021,2021.0,Bangalore,"Rishi Vasudev, Rameswar Misra","Tiger Global, Flipkart Ventures",,,G.O.A.T
,Food & Beverages,Pre-series A,,,"Keeros Roasted Supersnacks that are Healthy for All, Safe for Diabetics.",2021,2017.0,Lucknow,"Sachin Sahni, Simran Sahni",Venture Catalysts,,,Keeros
,Merchandise,Pre-series A,300000.0,,"Merchandise drop-shipping platform for influencers, designers, creators & brands.",2021,2016.0,Mumbai,"Smriti Dubey, Shikhar Vaidya",Anthill Ventures,,,ReDesyn
,Facilities Services,,200000.0,,"For residential commercial and industrial establishments , Inspacco is a one stop solution , that delivers affordable improvement and maintenance services",2021,2019.0,Pune,"Sanket Nerkar, Paresh Kotkar",,,,Inspacco
,EdTech,Pre-series A,1000000.0,,"Saas platform offers a feature packed platform enables businesses, experts, professionals, artists, instructors, specialists, coaches, people seeking work from home opportunities",2021,2016.0,Gurugram,"Rakhi Wadhwa, Kinner N Sacchdev","Inflection Point Ventures, Rockstud Capital, Pentathlon Ventures, Prophetic Ventures syndicate",,,Knorish
,Healthcare,Series A,5000000.0,,"Dozee is India's only contactless health monitor that silently tracks your heart, respiration, sleep patterns, stress levels, cardiac contractions, apnea and more while you sleep.",2021,2015.0,Bangalore,"Mudit Dandwate, Dandwate",Prime VP,,,Dozee
,Logistics & Supply Chain,Series E,67000000.0,,BlackBuck marks the beginning of a new path in trucking. A path that is organized and makes trucking simple for every shipper and trucker.,2021,2015.0,Bangalore,"B Ramasubramanian, Chanakya Hridaya, Rajesh Yabaji","Tribe Capital, IFC Emerging Asia Fund, VEF",,,BlackBuck
,Marketing & Advertising,Seed,2000000.0,,Mailmodo is a complete email marketing solution enabling users to create and send app-like interactive emails to improve email conversions.,2021,2020.0,Bangalore,"Aquibur Rahman, Apurv Gupta, Devyesh Tandon","Sequoia’s Surge, Y Combinator",,,Mailmodo
,Computer software,Seed,,,"Continuous Leadership Development & Employee Engagement platform. Improve Leadership, Culture and Experience real-time.",2021,2019.0,Bangalore,"Yasharth Mishra, Gaurav Bhawnani, Kunal Mishra",Endiya Partners,,,SuperBeings
,Healthcare,Series A,2500000.0,,Nirogstreet as a concept is working to make #Ayurveda first call of treatment.,2021,2018.0,New Delhi,Ram N Kumar,"Gokul Rajaram, Pureland Venture, Wavemaker Partners",,,NirogStreet
,Human Resources,Pre-series A,,,Hyreo stands for delivering a ‘customer-like’ experience for candidates throughout the recruiting process.,2021,2016.0,Thiruvananthapuram,"Arun Satyan, Mahesh Raju, Sreenath N",Callapina Capital,,,Hyreo
,Automotive,,,,GODI is a technology innovation organization focused on the design and manufacturing of green energy storage solutions.,2021,2020.0,Hyderabad,Mahesh Godi,Blue Ashva Capital,,,GODI Energy
,Healthcare,Seed,5000000.0,,One monthly subscription to cover all your healthcare needs.,2021,2020.0,Bangalore,"Mayank Banerjee, Matilde Giglio, Alessandro Davide Ialongo",Khosla Ventures,,,Even
,Logistics,Series A,12000000.0,,A B2B marketplace leveraging technology to deliver the fastest harvest-to-retail in the industry.,2021,2019.0,Bangalore,Utham Gowda,"Accel Partners, Matrix India",,,Captain Fresh
,Food & Beverages,Series A,10200000.0,,Otipy helps the farmer to deliver farm fresh vegetables & fruits at doorstep.,2021,2020.0,Gurugram,Varun Khurana,"Omidyar Network India, Innoven Capital",,,Otipy
,Eyewear,,220000000.0,,India's fastest growing eyewear company and largest eyewear company online.,2021,2008.0,Faridabad,Peyush Bansal,"Temasek, Falcon Edge",,,Lenskart
,Healthcare,,4500000.0,,A digitally enabled and connected healthcare ecosystem for better health outcomes.,2021,2020.0,Bangalore,Vikalp Sahni,"Deep Kalra, Ashish Kashyap, Rajesh Magow",,,Eka.care
,EdTech,,200000.0,,"BrainGroom is an online marketplace for educational, recreational & wellness classes with defined target segment, quantifiable outcomes & specified time duration.",2021,2015.0,Chennai,"Madhula Sathyamoorthy, Naliene Ramasamy, Kalaiarsi Periasamy","IAN, Social Alpha, Startup Oasis",,,Braingroom
,Consumer Services,Pre-series A,1000000.0,,"Edvizo is an online marketplace to help students and parents find, compare and enroll in the best and trusted private institutes in their locality",2021,2017.0,Bangalore,Ravi Nishant,Inflection Point Ventures,,,Edvizo
,FinTech,,25000000.0,,An education loan platform to finance meritorious students for the college expenses by underwriting future employability,2021,2017.0,New Delhi,Avinash Kumar,Capital India,,,Credenc
,D2C Business,Series A,150000000.0,,Globalbees partners with entrepreneurs who have built an online-first business.  Our team scales up D2C businesses in India and abroad.,2021,2021.0,New Delhi,Nitin Agarwal,"FirstCry, Lightspeed Venture Partners",,,GlobalBees
,Automotive,Series D,108000000.0,,Spinny is a new age used car end-to-end platform in India.,2021,2015.0,Gurugram,"Niraj Singh, Mohit Gupta, Ramanshu Mahaur",Tiger Global,,,Spinny
,Biotechnology,Series A,4000000.0,,Mynvax is a pre-clinical stage vaccine biotechnology. Current develop programs include a recombinant vaccine for human influenza and COVID19.,2021,2017.0,Bangalore,"Dr Raghavan Varadarajan, Dr Gautham Nadig","Accel, LetsVenture, 1Crowd",,,Mynvax
,Human Resources,,500000.0,,RiseBird provides on-demand 2.5K + expert video interviews and A.I. powered insights to help companies hire online.,2021,2018.0,Pune,Ashutosh Seth,SAB Holdings,,,RiseBird
,Healthcare,Pre-seed,330000.0,,Digital health platform delivering personalized care for women’s sexual and reproductive health concerns,2021,2020.0,Bangalore,Mehak Malik,Titan Capital,,,Uvi Health
,Farming,,13000000.0,,Vegrow is in the business of fresh fruits & vegetables with addressable market size of $43 Billion.,2021,2020.0,Bangalore,"Praneeth Kumar, Shobhit Jain, Mrudhukar Batchu, Kiran Naik","Lightspeed Venture Partners, Elevation Capital",,,Vegrow
,Automotive,,500000.0,,"Automovill is a unique platform to aggregate automobile service providers, where we connect vehicle owners with all kind of automobile service providers under one roof.",2021,2015.0,Bangalore,"Mridu Mahendra Das, Chinmay Baruah",Mumbai Angels Network,,,Automovill
,NFT Marketplace,Seed,,,"NFT Marketplace to buy or sell NFT tokens in minutes or set up your own NFT store, website, a storefront in minutes.",2021,2021.0,Gurugram,Toshendra Sharma,Jayanti Kanani,,,NFTically
,Healthcare,Series C,75000000.0,,HealthifyMe is a revolutionary health and fitness application that is on a mission to transform a billion lives!,2021,2012.0,Bangalore,"Tushar Vashisht, Sachin Shenoy","LeapFrog, Khosla Ventures",,,HealthifyMe
,FinTech,,450000.0,,GalaxyCard is a mobile based Instant Credit Card.,2021,2017.0,Gurugram,Amit Kumar,JITO Angel Network,,,GalaxyCard
,Healthcare,,10000000.0,,Bella Vita Organic or ‘The Good Life’ is dedicated to creating handcrafted and organic beauty solutions inspired by the natural elements of the earth and age old beauty best practices.,2021,2018.0,Gurugram,Aakash Anand,Ananta Capital,,,Bella Vita Organic
,FinTech,,10000000.0,,India's Most Preferred Instant Loan App,2021,2016.0,Bangalore,"Jayant Upadhyay, Amit Chandel, Rohit Garg","Northern Arc, Vivriti Capital",,,SmartCoin
,EdTech,Seed,,,"Careerninja Is A Funded, Early-stage Ed-tech Venture Building A Personalized Learning Platform To Help People Achieve Their Career Goals",2021,2017.0,Mumbai,Shronit Ladhaniai,Unitus Ventures,,,CareerNinja
,Solar,,2000000.0,,"India's Largest Online Rooftop Solar Platform for SMEs, Industries & Homes",2021,2016.0,New Delhi,Gagan Vermani,TATA Cleantech Capital,,,MYSUN
,Biotechnology,Series B,9000000.0,,"Sea6 Energy envisions a future where the abundant oceans will be our biomass farms of tomorrow - to provide solutions in energy, agriculture and food.",2021,2010.0,Bangalore,"Sailaja Nori, Nelson Vadassery, Sowmya Balendiran, Shrikumar Suryanarayan",Aqua-Spark,,,Sea6 Energy
,Consumer Goods,Seed,500000.0,,"Eco-friendly home and kitchen care products that are plastic-free, high in quality and affordable.",2021,2018.0,Mumbai,"Aditya Ruia, Akshay Varma, Anuj Ruia",Climate Angels Fund,,,Beco
,Internet,,5000000.0,,"OneCode is a platform which connects new age digital first brands with ""relevant"" sellers (aka OneCoders) to sell their products and services",2021,2020.0,Bangalore,"Manish Shara, Yash Desai","Sequoia’s Surge, Nexus Venture Partners",,,OneCode
,Information Technology,Seed,1200000.0,,MedPay® is building the real-time claims adjudication platform for health insurers.,2021,2020.0,Bangalore,"Arun Bhatia, Ravi Chandra","Entrepreneur First (EF), GrowX Ventures",,,MedPay
,Internet,,60000000.0,,Built Inshorts with a promise to deliver news,2021,2013.0,Noida,Azhar Iqubal,Vy Capital,,,Inshorts
,SpaceTech,Seed,2500000.0,,"Digantara is an Indian Space Technology Company incubated at Indian Institute of Science (IISc), establishing a space-based surveillance platform with global realtime earth coverage",2021,2018.0,Bangalore,"Anirudh N Sharma, Rahul Rawat, Tanveer Ahmed",Kalaari Capital,,,Digantara
,AgriTech,Seed,700000.0,,Aqgormalin is a tech driven farm diversification platform enabling farmers to diversify into Animal Husbandry and Aquaculture.,2021,2018.0,Chennai,"Prasanna Manogaran, Bharani CL",Zephyr Peacock,,,Aqgromalin
,Real Estate,,25000000.0,,India’s largest tech enabled Real Estate Brokerage and Mortgage Marketplace,2021,2014.0,Gurugram,Tanuj Shori,ADM Capital,,,Square Yards
,Hospitality,,660000000.0,,OYO is a global platform that empowers entrepreneurs and small businesses with hotels and homes by providing full-stack technology,2021,2013.0,Gurugram,Ritesh Agarwal,"SoftBank Vision Fund, Hindustan Media Venture",,,OYO
,Computer software,,,,Slang Labs provides accurate and multilingual in-app voice assistants for Android and web apps,2021,2017.0,Bangalore,Kumar Rangarajan,100x Entrepreneurs,,,Slang Labs
,Healthcare,Seed,,,"Simplifying Diagnostics for labs, doctors, and people.",2021,2019.0,Gurugram,"Joyneel Acharya, Shweta Gandhi","Healthcare veterans, PIEDS",,,NirogGyan
,Automotive,Debt,100000000.0,,Ola Electric - The future of mobility is here.? Charging ahead to accelerate the world’s transition to sustainable mobility.,2021,2017.0,Bangalore,Bhavish Aggarwal,Bank of Baroda,,,Ola Electric
,Consumer software,,1300000.0,,"Bikry, a Direct-to-Customer platform to start your online store within 30 seconds at 0% commission",2021,2019.0,Noida,Abhishek Bhayana,YCombinator,,,Bikry app
,EdTech,,3000000.0,,Oliveboard is the top exam preparation platform for Banking & Government Exams.,2021,2012.0,Bangalore,"Abhishek Patil, V Satish Kumar",IAN Fund,,,Oliveboard
,EdTech,$300000,,,Soft Skills that make Smart Leaders,2021,2020.0,New Delhi,Holistic Development Programs for children in age range 5-15,Vishal Gupta,,,Little Leap
,Social commerce,Series B,45000000.0,,India's Largest Lifestyle Social Commerce platform. Empowering millions of storytellers & Micro-Entrepreneurs.,2021,2016.0,Bangalore,"Pulkit Agarwal, Prashant Sachan, Arun Lodhi, Bimal Kartheek Rebba","Mirae Asset, H&M",,,Trell
,EdTech,,1000000.0,,Kredent Academy is the unique concept where financial market professionals have taken the onus of creating a strong knowledge bank in their area of expertise,2021,2008.0,Kolkata,"Vineet Patawari, Vivek Bajaj, Vinay Pagaria",Kotak Securities,,,Kredent
,Healthcare,Seed,500000.0,,India’s First Digital Admission Desk for Hospitalisation.,2021,2020.0,Mumbai,"Manoj Gupta, Gunjali Kothari",Venture Catalysts,,,EasyAspataal
,Food & Beverages,,,,Instigate your sixth sense with our new range of chocolates.,2021,2008.0,Bangalore,Vimal Sharma,Klub,,,SMOOR
,Social community,,3200000.0,,"Pankhuri is a women's only community for members to socialize, explore and upskill through live interactive courses, expert chat and interest-based clubs.",2021,2019.0,Bangalore,Pankhuri Shrivastava,Sequoia’s Surge,,,Pankhuri
,Information Technology,Seed,370000.0,,Arcana is the Storage Layer of Ethereum.,2021,2019.0,Bangalore,"Mayur Relekar, Aravindh Kumar, Abhishek Chaudhary",Balaji Srinivasan,,,Arcana
,EdTech,,,,A tech solution for end to end career advisory to students looking to study abroad.,2021,2016.0,Noida,"Vamsi Krishna, Pulkit Jain, Gaurav Munjal	#REF!",$1000000,,,AdmitKard
,Food & Beverages,,,,A modern farms close to where your home is. Creating positive change at every step from seed to store ensuring quality and traceability.,2021,2017.0,Hyderabad,"Srinivas Chaganti, Vihari Kanukollu, Sairam Reddy",BASF Venture Capital GmbH,,,UrbanKisaan
,Fishery,Pre-series A,4000000.0,,Aquaconnect is a global full-stack aquaculture technology venture that provides data-driven farm advisory and marketplace solutions to fish and shrimp farmers,2021,2017.0,Chennai,Rajamanohar,"Rebright Partners, Flourish Ventures",,,Aquaconnect
,EdTech,,1800000.0,,A mission to educate India and make its young and dynamic population job ready.,2021,2020.0,Bangalore,"Shailesh Daxini, Akash Senapaty, Muthukaleeshwaran Subbiah",Sequoia Surge,,,Vah Vah!
,Apparel & Fashion,Pre-series A,300000.0,,Building India's version of Stitch Fix,2021,2019.0,Gurugram,Aditya B,"Titan Capital, Sequoia Capital",,,LetsDressUp
,Computer software,,150000.0,,Aim to provide the most intelligent AI-powered policy making solutions for government institutions across the world.,2021,2019.0,Mumbai,"Ashwin Srivastava, Hardik Somani, Prashant Nikam",Parthiv Group,,,Sapio Analytics
,Human Resources,$300000,,,A Future of Work Platform for diffusing Employee Tacit Knowledge and enabling Peer Learning Networks,2021,2020.0,Mumbai,Backed by 100x.VC,"Omkar Pandharkame, Ketaki Ogale",,,BHyve
,Renewables & Environment,Seed,,,"Indi Energy is an energy storage startup involved in R&D of next generation battery technologies, with superior performance than current counterparts.",2021,2019.0,Roorkee,Dr. ASIT SAHOO,Mumbai Angels Network,,,Indi Energy
,Consumer Goods,,,,The Ayurveda Co. represents things that are all Ayurvedic at heart and are suited for the contemporary landscape.,2021,2021.0,Gurugram,"Param Bhargava, Shreedha Singh","GetVantage, Velocity, Shiprocket Capital",,,The Ayurveda Co
,Online storytelling,,48000000.0,,"Pratilipi is the largest Indian language self-publishing platform with over 350,000 authors and more than 28,000,000 unique monthly readers.",2021,2015.0,Bangalore,Ranjeet Pratap Singh,"Krafton Inc, Omidyar",,,Pratilipi
,Automotive,Pre-series A,35000000.0,,Autonomous industrial vehicle maker,2021,2017.0,Bangalore,"Saurabh Chandra, Saad Nasser","Blume Ventures, Exfinity Venture Partners",,,Ati Motors
,Deeptech,Pre-series A1,300000.0,,An AR / VR tech based Start-up in Mumbai.,2021,2018.0,Mumbai,"Dharmin Vora, Dhruvesh Mehta, Parth Vora",Inflection Point Ventures,,,peAR
,Farming,,3000000.0,,"100% contamination free, pesticide free naturoponically grown vegetables.",2021,2019.0,Bangalore,Arjun Balaji,"Beyond Next Ventures, M Venture Partners",,,Gourmet Garden
,Consumer Goods,Pre-series A,1000000.0,,Patent Pending sleep technology developed by actual Rocket Scientists and sleep experts after years of research.,2021,2019.0,Mumbai,,Fireside Ventures,,,The Sleep Company
,B2B E-commerce,Seed,,,Tyreplex is digitizing the tyre dealers in India.,2021,2020.0,New Delhi,"Puneet Bhaskar, Rupendra Pratap Singh",AdvantEdge Founders,,,TyrePlex
,Automotive,Pre-series A,3600000.0,,Advanced Electronics & Software Supplier for Electric Vehicles & Battery Energy Storage,2021,2016.0,Mumbai,Akhil Aryan,,,,ION Energy
,Insuretech,,200000000.0,,"Digit becomes the first Unicorn of 2021, valued at $1.9B.",2021,2016.0,Bangalore,Kamesh Goyal,"Faering Capital, Sequoia Capital India, IIFL Alternate Asset Managers",,,Digit Insurance
,Food & Beverages,Series A,11000000.0,,FRAAZO is Mumbai's favourite App for Fresh Vegetables and Fruits coming straight from the Farm to your Doorstep within 18 Hours.,2021,2020.0,Mumbai,"Atul Kumar, Aashish Krishnatre","Sixth Sense Ventures, NABVENTURES",,,FRAAZO
,Food & Beverages,Series F,192000000.0,,"Licious is a consumer food company, focussed at delighting the world with an unmatched range of meat & meat products.",2021,2015.0,Bangalore,"Abhay Hanjura, Vivek Gupta","Temasek, Multiples PE",,,Licious
,Gaming,Series C,65000000.0,,WinZO is the largest social gaming and entertainment platform in India.,2021,2018.0,New Delhi,Paavan Nanda,Griffin Gaming Partners,,,WinZO
,Consumer Goods,,100000000.0,,Furlenco is a different furniture company.,2021,2012.0,Bangalore,Ajith Mohan Karimpana,Zinnia Global,,,Furlenco
,Aviation,Pre-series A,3000000.0,,"Enterprise drone solutions that help plan, build, and sustain the world we live in.",2021,2014.0,Bangalore,Mughilan Thiru Ramasamy,"InfoEdge Ventures, IAN Fund",,,Skylark Drones
,IT company,Pre-series A,,,"The market standard for eSign, eStamp and Document Workflow in India. Eliminating paper from paperwork since 2016",2021,2016.0,Gurugram,Shivam Singla,"IIFL, Mumbai Angels",,,Leegality
,Healthcare,,,,Mission is to advance global standards of assisted living and make it dignified and safer.,2021,2015.0,Pune,Ganesh Sonawane,Klub,,,Arcatron Mobility
,FinTech,,2500000.0,,"TWID is shaping the future of Digital Currencies, delivering new-age fintech solutions",2021,2020.0,Bangalore,"Amit Sharma, Amit Koshal, Rishi Batra","BEENEXT, Sequoia’s Surge",,,TWID
,EdTech,Early seed,,,"A goal-oriented, outcome-driven platform to make leadership coaching accessible to all.",2021,2020.0,Bangalore,"Aishwarya Goel, Gaurav Jhunjhnuwala",Antler India,,,PeakPerformer
,Internet,Pre-series A,1400000.0,,"Crowdsourcing platform imparting best-in-class services with immensely talented, skilled & qualified workforce pan-India",2021,2018.0,Noida,"Dheeraj Khatter, Himanshu Kumar, Kshitiz Saini",Bharat Inclusion,,,MyMobiForce
,Information Technology,,600000.0,,A merchant platform company that provides financing and last-mile retail transaction technology to merchants,2021,1998.0,Noida,Amrish Rau,"Fidelity, BlackRock",,,Pine Labs
,Healthcare,,2000000.0,,GENWORKS Health is an initiative by GE for empowering healthcare professionals operating in the rural areas to deliver better medical facilities and diagnostics while keeping things affordable.,2021,2015.0,Bangalore,S Ganeshprasad,Blacksoil,,,Genworks Health
,FinTech,,,,"Pocketly provides quick cash on hand, anytime - anywhere!",2021,2019.0,Bangalore,"Aarav Bhatia, Navdeesh Ahuja",,,,Pocketly
,Information Technology,Seed,370000.0,,A cloud platform to bring any GUI application regardless of OS and Device type to the browser.,2021,2019.0,Bangalore,"Lakshmana Pasala, Ram Pasala",Speciale Invest,,,Neverinstall
,Information Technology,,,,CoRover is the world’s first and the highest ROI delivering human-centric conversational AI platform.,2021,2016.0,Bangalore,"Ankush Sabharwal, Manav Gandotra, Kunal Bhakhri",Canbank Venture Capital Fund,,,CoRover
,Healthcare,Pre-series B,5000000.0,,ULTIMATE app to manage chronic conditions.,2021,2015.0,New Delhi,Gautam Chopra,W Health Ventures,,,BeatO
,Cosmetics,Seed,1200000.0,,A mission to make customers healthier and Earth a little greener.,2021,2020.0,Gurugram,Harini Sivakumar,Anicut Angel Fund,,,Earth Rhythm
,Computer software,Seed,1900000.0,,"Fountain9 is a Y Combinator backed company, which offers predictive inventory planning and optimization software for e-commerce, DTC and retail companies.",2021,2019.0,Mumbai,"Niki Khokale, Rajas Lonkar","021 Capital, Y Combinator",,,Fountain9
,Food & Beverages,,1000000.0,,RockClimber is a new age beverage brand with a portfolio of alcoholic and non alcoholic drinks.,2021,2019.0,Bangalore,"Deepak Poduval, Hariprasad Shetty",Anand Prakash Sharma,,,Rockclimber
,EdTech,,300000.0,,"Provide Remediation, Occupational Therapy, Speech Therapy and Socio-emotional coaching for children with Learning Disabilities like Dyslexia, Dysgraphia, Dyscalculia",2021,2020.0,Mumbai,Dhaval Mody,,,,SpEd@home
,Computer software,Seed,,,"Digital-first debt collections platform that is driven by compassion, and powered by AI.",2021,2019.0,Bangalore,Arindam Choudhury,Axilor Ventures,,,CanPe
,Consumer Goods,,200000.0,,Green Soul is No.1 brand on Amazon India in Ergonomic chairs category in terms of customer reviews.,2021,2016.0,Ambernath,Ravi Khushwani,velocity.in,,,Green Soul
,Logistics,Series D1,41000000.0,,India's #1 eCommerce Logistics and Shipping Solution Empowering over 1 Lakh Indian eCommerce Sellers.,2021,2012.0,New Delhi,"Saahil Goel, Akshay Ghulati","March Capital, Tribe Capital",,,Shiprocket
