Freshokartz,AgriTech,Pre-series A,1000000.0,,,2020,2016.0,"Jaipur, Rajastan","Chandrakanta, Rajendra Lora","Rajasthan Venture Capital Fund, Innovana Thinklabs","Freshokartz provides soil data based crop and fertilisers recommendation to farmers and delivery seeds, pesticides",,
FlexiLoans,FinTech,Debt,6000000.0,,,2020,2016.0,Mumbai,"Abhishek Kothari, Deepak Jain, Manish Lunia, Ritesh Jain",>Vikram Sud,"an online lending platform started with an endeavour to solve the problem that SMEs face in accessing Quick, Flexible and Adequate funds for growing their Businesses.",,
Agrix,AgriTech,,,,,2020,2020.0,Patna,"Nilay Pandey, Saurav Singh, Vivek Kumar",Maple Capital Advisors,"Farming-as-a-service (covering farm machinery and agri input services) and provides market linkages, especially for fragmented farm owners.",,
BharatAgri,AgriTech,Pre-series A,,,,2020,2017.0,Pune,"Siddharth Dialani, Sai Gole","021 Capital, India Quotient",A Smart Farming Technology Platform for Indian Farmers,,
FreshtoHome,E-commerce,Series C,121000000.0,,,2020,2015.0,Bangalore,Shan Kadavil,"Ascent Capital, Iron Pillar",Freshtohome is an e-commerce platform for fresh and chemical-free seafood.,,
Credable,FinTech,,4500000.0,,,2020,2017.0,Mumbai,Nirav Choksi,Oaks Asset Management,CredAble provides working capital & supply chain finance programs for large enterprises and their suppliers and distributors.,,
Railofy,Transportation,Seed,5000000.0,,,2020,2019.0,Mumbai,"Rohan Dedhia, Vaibhav Saraf, Hrishabh Sanghvi","Roots Ventures, Better Capital",Railofy is a WL & RAC protection that enables waitlisted passengers to reach their destination at the lowest possible price.,,
Finova Capital,FinTech,,55000000.0,,,2020,2016.0,"Jaipur, Rajastan","Mohit Sahney, Sunita Sahney","Sequoia Capital India, Faering Capital",Finova Capital is a non-banking financial company.,,
Teachmint,Edtech,Seed,3500000.0,,,2020,2020.0,Bangalore,"Mihir, Payoj Jain, Divyansh Bordia, Anshuman Kumar",Lightspeed India,Teachmint is an easy to use platform for tutors to conduct unlimited live classes and manage their classrooms,,
Peel-Works,E-commerce,,3000000.0,,,2020,2010.0,Mumbai,"Sachin Chhabra, Nidhi Ramachandran","CESC Ventures, Brun Raschle",Peel-Works is a tech and data analytics company specializing in e-commerce for corner stores.,,
Janani,Fertility tech,Pre-seed,200000.0,,,2020,2020.0,Bangalore,Nilay Mehrotra,9Unicorns,Janani aims to make the process of infertility treatment and assisted fertilisation easier,,
Credgenics,FinTech,Seed,3300000.0,,,2020,2018.0,Gurugram,"Anand Agrawal, Mayank Khera, Rishabh Goel","Accel, Sunder Nookala","Credgenics is a tech-enabled platform backed by Titan Capital, helping fintech lenders and Banks in their critical NPA reduction",,
Finelistings,Luxury car startup,,,,,2020,2015.0,New Delhi,Aneesh Mathur,Justdial,A Used Luxury Car Marketplace,,
Wellversed,Healthcare,Pre-series A,,,,2020,2018.0,New Delhi,"Aanan Khurma, Aditya Seth, Ripunjay Chachan","KLUB Works, Shankar Narayanan",Wellversed Health enables production of customised clinical food products specific to health requirements of a demography or an individual.,,
Nykaa,Cosmetics,,,,,2020,2012.0,Mumbai,Falguni Nayar,"Alia Bhatt, Katrina Kaif",Nykaa is an online marketplace for different beauty and wellness products.,,
Jumbotail,E-commerce,Series B2,11000000.0,,,2020,2015.0,Bangalore,"Ashish Jhina, Karthik Venkateswaran",Nexus Venture Partners and 23 High Networth Individuals (HNIs),"Jumbotail is solving an important problem of organising food and grocery ecosystem in India through technology, data science and design.",,
Winzo,Gaming startup,,2000000.0,,,2020,2018.0,New Delhi,"Paavan Nanda, Saumya Singh Rathore","Makers Fund, Courtside Ventures",WinZO is a mobile e-sports social gaming platform that offers monetary benefits and prizes to players.,,
mCaffeine,Cosmetics,Series B,5000000.0,,,2020,2015.0,Mumbai,"Tarun Sharma, Vikas Lachhwani","RPSG Ventures, Amicus Capital","MCaffeine is a personal care brand that offers caffein-infused face, body, and hair care products.",,
Pocket FM,FM,Series A,5000000.0,,,2020,2018.0,Bangalore,Rohan Nayak,"Times Group, Lightspeed",Pocket FM is an audiobook & podcast app that brings you over 10K+ popular audiobooks.,,
Snackible,Healthcare,Bridge,,,,2020,2015.0,Mumbai,,"Mumbai Angels, Murali Nair",Snackible operates a health-food production company designed to sell healthy snack food via online and offline channels.,,
FreshtoHome,E-commerce,,16000000.0,,,2020,2015.0,Bangalore,Shan Kadavil,"Ascent Capital, Iron Pillar",Freshtohome is an e-commerce platform for fresh and chemical-free seafood.,,
Jumbotail,Retail,Series B2,11000000.0,,,2020,2015.0,Bangalore,"Ashish Jhina, Karthik Venkateswaran","Nexus Venture Partners, Capria Ventures",Jumbotail is solving an important problem of organising food and grocery ecosystem in India,,
Nykaa,E-commerce,,,,,2020,2012.0,Mumbai,Falguni Nayar,"Katrina Kaif, Steadview Capital",Nykaa is an online marketplace for different beauty and wellness products.,,
TagZ Foods,Food,,,,,2020,2019.0,Bangalore,"Sagar Bhalotia, Anish Basu Roy","Exfinity Venture Partners, Shesh Kondi",TagZ Foods is a supplier of snacks and food products.,,
Genius Teacher,Edtech,,2000000.0,,,2020,2016.0,Mumbai,"Advitiya Sharma, Gaurav Lahoti","Sandeep Tandon, Daniel Lapus","Genius Teacher creates engaging educational content, delivers fun learning experience to the students",,
Krimanshi Feeds,Nutrition sector,,500000.0,,,2020,2015.0,Jodhpur,Nikhil Bohra,"Rajasthan Venture Capital Fund, AIM Smart City",Krimanshi aims to increase rural income by improving the productivity of Indian cattle with better quality feed.,,
Origo,AgriTech,Debt,4000000.0,,,2020,2010.0,Gurugram,"Sunoor Kaul,",Northern Arc Capital,Provider of marketing and warehousing services for agricultural commodities.,,
GetVantage,FinTech,Seed,5000000.0,,,2020,2019.0,Mumbai,"Amit Srivastava, Bhavik Vasa, Sachin Tagra, Sachin Tagra","Samyakth Capital, Venture Catalysts",GetVantage is India and Southeast Asia's first fintech enabled Revenue-based financing platform.,,
Betterplace,Tech platform,Series B,10000000.0,,,2020,2015.0,Bangalore,"Saurabh Tandan, Pravin Agarwala",Jungle Ventures,Developer of a digital verification platform designed to manage the semi-formal workforce.,,
Biddano,Healthcare,Pre-series A,600000.0,,,2020,2016.0,Mumbai,Talha Shaikh,Windrose Capital,India's 1st tech-enabled healthcare logistics platform.,,
InVideo,Video,Series A,15000000.0,,,2020,2017.0,Mumbai,"Harsh Vakharia, Pankit Chheda, Sanket Shah","Base Partners, Sequoia Capital India",InVideo enables you to transform your content into great videos.,,
Arzooo,Retail Tech,Series A,7500000.0,,,2020,2016.0,Bangalore,"Khushnud Khan, Rishi Raj Rathore","3Lines, Jabbar Internet Group","Retail tech platform empowering 300,000+ small retailers in electronics space to compete with big organised players and increase sales",,
Hubilo,Tech company,Seed,4500000.0,,,2020,2020.0,"San Francisco, California, United States","Mayank Agarwal, Vaibhav Jain","Nishant Rao, Jonathan Boutelle",World’s smartest virtual event platform that brings Experience & Intelligence together,,
BASIC Home Loan,FinTech,Seed,5000000.0,,,2020,2020.0,Gurugram,Atul Monga,Picus Capital,"A platform for automating home loans for middle and low-income households in India,",,
Ketos,AI startup,,18000000.0,,,2020,2015.0,"San Francisco, United States",Meena Sankaran,"Citi Ventures, Illuminated Funds Group",KETOS provides hardware and software analytics solutions and real-time data for usage and flow across water systems.,,
SUGAR cosmetics,Cosmetics,Debt,2000000.0,,,2020,2012.0,Mumbai,"Kasuhik Mukherjee, Vineeta Singh","A91 Partners, RB Investments Pte. Ltd",It is a cruelty-free makeup brand providing cosmetics that is high on style and higher on performance.,,
Signzy,FinTech,,5400000.0,,,2020,2015.0,Bangalore,"Ankit Ratan, Ankur Pandey, Arpit Ratan","GenNext Ventures, Contrarian Drishti Partners",It is creating 'building blocks for a Digital Trust system.,,
Ahaguru,Edtech,Series A,,,,2020,2012.0,Chennai,"Gomathi S, Dr Balaji Sampath",Anand Mahindra,"It is conducting IIT JEE Coach for Physics, Math and Chemistry easily.",,
Tekion,AI startup,Series C,150000000.0,,,2020,2016.0,"San Ramon, California","Guru Sankararaman, Jay Vijayan","Alliance Ventures, Storm Ventures",It is a cloud-built platform with advanced machine learning and AI capabilities for a personalized and seamless consumer experience.,,
Brighteye Ventures,Edtech,,5400000.0,,,2020,2017.0,"Paris, Ile-de-France, France",David guerin,Tandem,Education technology venture capital firm.,,
EzeRx,Medtech,Seed,200000.0,,,2020,2018.0,Kolkata,"Amit mandahar, Chaitali roy","Indian Oil Corporation, Krishna Chakravarty",Developer and manufacturer of medical devices,,
VitalTech,HeathTech,Seed,3000000.0,,,2020,2018.0,"Plano, Texas, United States",Anjan Panneer Selvam,Tech Mahindra,"VitalTech is a develop technologies that empower patients to better care for their safety,",,
Genius Teacher,Edtech,,2000000.0,,,2020,2016.0,Mumbai,"Advitiya Sharma, Gaurav Lahoti","Whiteboard Capital, VKG Ventures LLP.","Genius Teacher creates engaging educational content, delivers fun learning experience to the students",,
Ultraviolette Automotive,Automobiles,Series B,4000000.0,,,2020,2014.0,Bangalore,"Narayan Subramaniam, Niraj Rajmohan",TVS Motor Company,Ultraviolette Automotive is a technology startup working on electric two-wheelers and energy infrastructure.,,
Tring,Social Media,,,,,2020,2019.0,Mumbai,"Akshay Saini, Rahul Saini, Pranav Chabhadia","Sujeet Kumar, Hemesh Singh","Tring is a celebrity engagement platform, for all occasions including birthday, anniversaries, get well soon messages.",,
Rare Planet,Retail startup,Pre-series A,400000.0,,,2020,2015.0,Kolkata,"Ranodeep Saha, Vijay Kumar",Venture Catalysts,Rare Planet sells handicrafts made by local artisans.,,
GoodGamer,Gaming,Seed,2500000.0,,,2020,2020.0,Bangalore,Charles Creighton,,GoodGamer is India's first Daily Fantasy Sports and true Esports gaming platform.,,
InnAccel,Medtech,Pre-series A,1500000.0,,,2020,2012.0,Bangalore,Siraj Dhanani,Mount Judi Ventures,"A building a portfolio of novel medical devices designed, engineered, and priced for global Emerging Markets.",,
Tiliter,Retail,,7500000.0,,,2020,2017.0,Sydney,"Chris Sampson, Marcel Herz, Martin Karafilis","AngelList, Investec",Software that uses computer vision to recognise products without barcodes,,
Slintel,Sles and marketing,,4200000.0,,,2020,2016.0,"San Francisco Bay Area, Silicon Valley, West Coast","Deepak Anchala, Rahul Bhattacharya, Ranjana TN","Accel, Stellaris Venture Partners","Slintel, a leader in capturing technographics-powered buying intent, helps companies uncover the 3% of active buyers in their target market.",,
SoOLEGAL,LegalTech,,4000000.0,,,2020,2015.0,New Delhi,Manish Kaul,,"SoOLEGAL is a global integrated directory of lawyers, legal aid organizations, and Law firms.",,
HobSpace,Edtech,Seed,200000.0,,,2020,2019.0,Mumbai,"Priya Goel Sheth, Harsh Jain",Artha Venture,India's Activity Hub for Kids,,
Supplynote,SaaS startup,Seed,500000.0,,,2020,2015.0,Noida,"Abhishek Verma, Harshit Mittal, Kumar Kushang, Nitin Prakash","MOX, SOSV",Supplynote is India's leading procurement platform with a unique stack of SAAS and E-commerce to solve the procurement problem,,
Hire Me Car,Car Service,Seed,,,,2020,,Noida,Pankaj Sharma,,India's largest cloud based digital discovery and services provisioning platform for the taxi rental,,
ShopUp,E-commerce,Series A,22000000.0,,,2020,2017.0,Bangaldesh,"Afeef Zaman, Ataur Rahim Chowdhury, Siffat Sarwar","Flourish Ventures, Lonsdale Capital","ShopUp provides easy access to B2B sourcing, last-mile logistics, digital credit, and business management solutions to small businesses.",,
Harmonizer India,Tech Startup,,,,,2020,2019.0,Bangalore,M R Srinivas,Kapil Dev,"Energy-efficient solutions based on the Artificial Intelligence, Machine Learning and Internet of Things technology,",,
Zomato,FoodTech,,52000000.0,,,2020,2008.0,Gurugram,"Deepinder Goyal, Gaurav Gupta, Pankaj Chaddah","Kora, Tiger Global Management",Zomato is a food delivery and restaurant discovery site that provides information and reviews about restaurants.,,
Dukaan,Tech Startup,Seed,6000000.0,,,2020,2020.0,Mumbai,"Subhash Choudhary, Suumit Shah","Lightspeed, Matrix Partners.",Developer of an android application designed for businesses to sell online.,,
CredR,Bike marketplace,,2000000.0,,,2020,2014.0,Mumbai,"Nikhil Jain, Nittin Mittal, Sumit Chhazed","Eight Roads Ventures, On Mauritius",India’s Only 100% Inspected and Certified Used Bikes Marketplace.,,
Satyukt,Agri tech,Seed,500000.0,,,2020,2018.0,Bangalore,"Sat Tomer, Yukti Gill","NABVENTURES, Social Alpha (India)",An agritech company that provides business to business (B2B) agricultural data,,
RACEnergy,Automobiles,,,,,2020,2018.0,Hyderabad,"Arun Sreyas, Gautham Maheswaran","growX Ventures, Huddle (Incubator)",RACEnergy builds and deploys battery swapping infrastructure for use in various segments of vehicles.,,
TREAD,Fitness startup,Pre-seed,1100000.0,,,2020,2020.0,Bangalore,Dinesh Godara,"Better Capital, Kunal Shah, Gaurav Munjal",A homegrown fitness startup that aims to advance the 'Fit India' initiative by offering holistic and affordable workouts.,,
Anveshan,FoodTech,Pre-seed,100000.0,,,2020,2019.0,Bangalore,"Aayushi Khandelwal, Akhil Kansal, Kuldeep Parewa",Titan Capital,Provide quality and healthy food products,,
TeaMonk,Food & Bevarages,Pre-series A,900000.0,,,2020,2016.0,Bangalore,"Amit Dutta, Ashok Mittal","Lead Angels Network, Roots Ventures",India's Finest Specialty Tea company.,,
Fleetx,Tech Startup,Pre-series B,3000000.0,,,2020,2017.0,Gurugram,"Abhay Jeet Gupta, Parveen Kataria, Udbhav Rai, Vineet Sharma, Vishal Mishra","Rohit Bansal, Rohan Ranavat","Fleetx is an intelligent data platform which uses AI, machine learning, sensors and predictive analytics to help fleet owners.",,
ReNEWate,Real Estate,Pre-seed,,,,2020,2018.0,Pune,Supratik Ghatak,Real Estate Accelerator Program,"Tech platform helping millions of renovation contractors, property improvement professionals and businesses manage their business digitally.",,
Tango Eye,SaaS startup,Seed,,,,2020,2018.0,Chennai,Surender Gounder,"Riso Investments, Lenskart",Retail Video Analytics SaaS product,,
Rare Planet,Reatil startup,Pre-series A,,,,2020,2015.0,Kolkata,"Ranodeep Saha, Vijay Kumar",Venture Catalysts,Rare Planet sells handicrafts made by local artisans.,,
Avataa Me,AR platform,Series A,7000000.0,,,2020,2014.0,Bangalore,Gaurav Baid,Sequoia Capital India,AVATAAR.ME is a deep-tech 3D AR platform which delivers personalized fashion discovery experience to users on mobile devices.,,
Arrival,EV startup,,118000000.0,,,2020,2015.0,"London, England, United Kingdom",Denis Sverdlov,"UPS Ventures, Hyundai Motor Company",Arrival is a technology company that specializes in developing electric vehicles.,,
Cover Genius,FinTech,,15000000.0,,,2020,2014.0,"Sydney, New South Wales, Australia","Angus McDonald, Chris Bayley","King River Capital, Leap Capital",Cover Genius provides an insurance distribution platform designed to protect the customers of e-commerce companies,,
Phononic Vibes,Deeptech,,2300000.0,,,2020,2018.0,"Milano, Lombardia, Italy","Andrea Boeri, Braghin Francesco, Giovanni Capellari, Luca D'Alessandro, Stefano Caverni",,"Phononic Vibes introduces a new patented technology for vibration and noise control and isolation, with a circular economy approach.",,
MikeLegal,LegalTech,Seed,,,,2020,2017.0,Gurugram,"Tushar Bhargava, Anshul Gupta","SOSV, Artesian",MikeLegal is an AI powered legal associate that aims to build an ecosystem of legal tools,,
Clair,FinTech,Seed,4500000.0,,,2020,2019.0,"New York, United States","Alex Kostecki, Erich Nussbaumer, Nico Simko","Upfront Ventures, Walkabout Ventures",Clair is a social fintech that provides Instant Pay Access as a Service for human capital management and gig platforms.,,
Gourmet Garden,Consumer Goods,,,,,2020,1999.0,"Palmwoods, Queensland, Australia",Arjun Balaji,Advent Partners,Gourmet Garden is a global market leader in chilled convenient packaged herbs.,,
Miko,AI startup,Pre-series B,3000000.0,,,2020,2015.0,Mumbai,"Chintan Raikar, Prashant Iyengar, Sneh Vaswani","Stride Ventures, YourNest Venture Capital","Miko is an advanced robotics startup founded by three IIT Bombay post-graduates on the pillars of robotics, AI & IoT.",,
Razorpay,FinTech,Series D,100000000.0,,,2020,2014.0,Bangalore,"Harshil Mathur, Shashank Kumar","Tiger Global Management, Sequoia Capital India","Razorpay is a platform that enables businesses to accept, process, and disburse payments.",,
Ninjacart,Food Industry,,30000000.0,,,2020,2015.0,Bangalore,"Ashutosh Vikram, Kartheeswaran K K, Sharath Loganathan, Thiru Nagarajan, Thirukumaran Nagarajan, Vasu Devan","Syngenta Ventures, Walmart","Ninjacart is a business-to-business fresh produce supply chain that connects farmers, manufactures, and brands to retailers directly.",,
Wow! Momo,Food Industry,Debt,5000000.0,,,2020,2008.0,Kolkata,"Binod Kumar Homagai, Sagar Daryani, Shah Miftaur Rahman","Tiger Global Management, William Bissell",Wow! Momo is a chain of fast-food restaurants that specializes in momos.,,
Pepper Content,Content marketplace,Series A,4200000.0,,,2020,2017.0,Mumbai,"Anirudh Singla, Rishabh Shekhar","Alok Mittal, Manan Maheshwari",Pepper Content is a Content-Mediation Platform that connects talented writers to organisations that require content.,,
LIVSPACE,Interior Design,Debt,4000000.0,,,2020,2014.0,Bangalore,"Anuj Srivastava, Ramakant Sharma, Shagufta Anurag","Mercer Investments, Bessemer Venture Partners","Livspace is an interior design startup that offers a platform that connects people to designers, services, and products.",,
Acculi Labs,Healthcare,Seed,600000.0,,,2020,2017.0,Bangalore,"HariPrasath M., Rupam Das",Startup Basket.,Acculi Labs is a clinical grade smartphone based diagnostic tool,,
Your MD,Healthcare,,25000000.0,,,2020,2012.0,"London, England, United Kingdom","Alessandro Traverso, Birger Lie, Harald Jellum, Matteo Berlucchi","Orkla Ventures, Smedvig Capital",Your.MD is a platform committed to helping a billion people find their health by unlocking self-care with digital technology.,,
Antaios,Tech company,,11000000.0,,,2020,2016.0,France,Jean Pierre Nozieres,,Developer of memory-based technology intended to solve issues of advanced computing.,,
Unnati,AgriTech,Pre-series A,1700000.0,,,2020,2017.0,Noida,"Amit Sinha, Ashok Prasad",NABVENTURES,A helping hand to the farming community through Artificial Intelligence,,
Disprz,Edtech,Pre-series B,1600000.0,,,2020,2015.0,Chennai,"Kuljit Chadha, Subramanian Viswanathan","Xseed Partners, InnoVen Capital","Disprz is a one-of-its-kind “knowledge-tech” start-up that strives to make people knowledgeable, productive and smarter at what they do.",,
Uni,FinTech,Seed,18500000.0,,,2020,,Mumbai,Nitin Gupta,"Lightspeed India Partners, Accel India",The team aims to bridge the gap for credit cards and make them more accessible for people across different regions.,,
Credit Wise Capital,FinTech,Seed,6000000.0,,,2020,1994.0,Mumbai,"Hirak Joshi, Aalesh Avlani",Venture Catalysts,CreditWise Capital is a consumer finance company.,,
Chargebee,SaaS startup,Series F,55000000.0,,,2020,2011.0,"San Francisco Bay Area, West Coast, Western US","KP Saravanan, Krish Subramanian, Rajaraman Santhanam, Thiyagarajan T","Accel, Steadview Capital",Chargebee is a PCI Level 1 certified subscription and recurring billing system for SaaS and subscription based eCommerce businesses,,
Reliance Retail Ventures Ltd,Retail,,70000000000.0,,,2020,2006.0,Mumbai,Mukesh Ambani,"Silver Lake, Mubadala Investment Company","Reliance Retail offers online shopping and a chain of neighborhood stores, supermarkets, and wholesale/specialty stores.",,
Winuall,Edtech,,2000000.0,,,2020,2019.0,Bangalore,"Ashwini Purohit, MS Chouhan","Amit Lakhotia, Akash Gehani","Winuall specializes in the fields of E-learning, online quizzes, and tests, study material for competitive exams.",,
Genrobotics,AI startup,,300000.0,,,2020,2015.0,"Trivandrum, Kerala, India","Arun George, Nikhil NP, Rashid Bin Abdulla, Vimal Govind MK",Unicorn India Ventures,GenRobotic specializes in powered robotic exoskeletons with RC controlled humanoid robotic systems and Artificial Intelligence.,,
Livve,Rental space,Seed,1500000.0,,,2020,2015.0,Cochin,Maya Lakshman,,An online platform where both owners and tenants find help in making sure their rental transaction are safe and secure.,,
Ergos,AgriTech,Series A,5000000.0,,,2020,2012.0,"Samastipur, Bihar","Kishor Kumar Jha, Praveen Kumar","Aavishkaar Venture Capital, Chiratae Ventures",Ergos is building an integrated supply chain by setting up micro warehouses.,,
Krishitantra,Soil-Tech,Seed,1000000.0,,,2020,2017.0,Hyderabad,"Sandeep Kondaji, Vishnuprasada Bhat, Anand Bellan Raman","NABVENTURES, Omnivore",Krishi-Tantra is an Agri-IoT startup building farm automation for controlled agricultural environment.,,
PakkaProfile,Recruitment startup,Seed,,,,2020,2019.0,Bangalore,"Nagmanjunath Shivakumar, Savio Sebastian",Java Capital,"PakkaProfile bridges the gap between companies and the workforce by making better, unbiased decisions with the help of psychometric games",,
Monet Networks,AI startup,Bridge,500000.0,,,2020,2014.0,"Irvine, California, United States",Anurag Bist,"SenseAI Ventures, EvoNexus",Monet Networks Using sentiment and non verbal cues analysis for increased engagement and real time content feedback.,,
Unocoin,FinTech,Series A,,,,2020,2013.0,"Tumkur, Karnataka","Abhinand Kaseti, Harish B V, Sathvik Vishwanath, Sunny Ray","Digital Finance Group, FundersClub","Unocoin is an Indian bitcoin processor that enables users to buy, sell, store, use, and accept bitcoins.",,
Pesto,Edtech,,,,,2020,2017.0,New Delhi,"Andrew Linfoot, Ayush Jaiswal","Sriharsha Majety, Rahul Jaimini",Pesto is a career accelerator for software engineers with the mission to take opportunities to places where talent exists.,,
NirogStreet,Ayurveda tech,Pre-series A,2000000.0,,,2020,2016.0,Gurugram,Ram N Kumar,"Wavemaker Partners, Subho Ray",NirogStreet is an Ayurvedic doctor discovery and appointment booking platform where patients can easily find doctors and fix consultation.,,
Bambrew,Packaging solution startup,Pre-seed,,,,2020,2018.0,Bangalore,Vaibhav Anant,Upsparks,Bambrew is an online shop for reusable bamboo straws.,,
Omnify,SaaS startup,Pre-series A,,,,2020,2016.0,"San Francisco Bay Area, Silicon Valley, West Coast","Kabandi Saika, Manik Mehta","Saurabh Arora, LD Sharma",Omnify is a Global SaaS platform for Small Services Business,,
Fanball XI,Gaming,Seed,1000000.0,,,2020,,New Delhi,Vinayak Seth,Foxhog Ventures,The gaming company mostly focused on fantasy football games,,
Treebo Hotels,Hospitality,,6000000.0,,,2020,2015.0,Bangalore,"Kadam Jeet Jain, Rahul Chaudhary, Sidharth Gupta","Ramesh Mangaleswaran, Saikiran Krishnamurthy","Treebo is India's tech-enabled, asset-light affordable accommodation brand.",,
GPS Renewables,Cleantech,Series A,3000000.0,,,2020,2010.0,Bangalore,"Mainak, Sreekrishna","Triodos, Caspian",To solve the urban waste problem by utilising local technologies and business models.,,
Public,Social Media,,30000000.0,,,2020,2019.0,New Delhi,Azhar Iqubal,"Lee Fixel's Addition, SIG Global, Tanglin Venture Partners",Video-led social app Public provides users with a platform to share and view important hyperlocal videos,,
Legal Salah,LegalTech,Seed,1000000.0,,,2020,2015.0,Kolkata,CA Abhinit Singh,I2I Capitals,Legal Salah is bringing the provision of imparting value based legal and consultancy services to the user.,,
FanPlay,Gaming,Seed,,,,2020,2018.0,New Delhi,"Bharat Gupta, Pritesh Kumar","Core91 Fund, Anupam Mittal",FanPlay Technologies operates as a real-money gaming startup.,,
ECOSTP,Sanitation solutions,,19000000.0,,,2020,2017.0,Bangalore,"Simar Kohli, Tharun Kumar, Praseed KK",Terwilliger Centre,Eco friendly zero power zero maintenance sewage treatment plant in India.,,
Coralogix,SaaS startup,Series B,25000000.0,,,2020,2013.0,"San Francisco, California, United States","Ariel Assaraf, Guy Kroupp, Lior Redlus, Yoni Farin","2B Angels, Janvest Capital Partners",Coralogix is a log analytics SaaS platform that improves the delivery and maintenance process for software providers.,,
Equiwatt,Tech company,,300000.0,,,2020,2015.0,"Newcastle Upon Tyne, Newcastle upon Tyne, United Kingdom","Johnson Fernandes, Ravneet Kaur",Rising Stars,Equiwatt is a digital platform enabling households to get paid for saving energy at peak times.,,
Reliance Retail Ventures,E-commerce,,800000000.0,,,2020,2006.0,Mumbai,Mukesh Ambani,"General Atlantic, Kohlberg Kravis Roberts","Reliance Retail offers online shopping and a chain of neighborhood stores, supermarkets, and wholesale/specialty stores.",,
Zhangmen,Edtech,,400000000.0,,,2020,2005.0,"Shanghai, China",Yi Zhang,"CICC Alpha, VMS Asset Management",Zhangmen is an online tutoring platform provides tutoring courses to students.,,
AgroWave,AgriTech,,500000.0,,,2020,2017.0,Gurugram,Anu Meena,Sekhar Puli,Agrowave engages in transforming agriculture supply chain by connecting farms to businesses.,,
Sapio Analytics,Tech company,,150000.0,,,2020,2018.0,Mumbai,"Ashwin Srivastava, Hardik Somani",,Sapio Analytics provides AI-powered policymaking solutions for government institutions.,,
Taimei,HealthCare,,176000000.0,,,2020,2013.0,"Jiaxing, Zhejiang, China",Lu Zhao,"Cowin Venture, ZSVC",Taimei Technology provides a cloud platform for clinical research collaboration.,,
Avanse Financial Services,FinTech,,15000000.0,,,2020,2012.0,Mumbai,Amit Gainda,International Finance Corporation,"Avanse, regulated by the Reserve Bank of India, is an education finance company that operates as a non-banking finance company (NBFC).",,
