Rupeek,Fintech,,30000000.0,,,2020,2015.0,Bangalore,"Amar Prabhu, Ashwin Soni, Sumit Maniyar","GGV Capital, Bertelsmann India Investments, Binny Bansal, Sequoia India, Accel Partners",An asset backed online lending platform,,
iMerit,IT,Series B,20000000.0,,,2020,2012.0,Kolkata,Radha Basu,CDC Group Plc,Turns information into data that is usable for machine learning processes,,
BharatPe,Fintech,Series C,75000000.0,,,2020,2018.0,Delhi,Ashneer Grover,Ribbit Capital,Digital payments platform,,
Invideo,Visual Media,,2500000.0,,,2020,,,Sanket Shah,Sequoia Capital’s Surge,Video production and editing platform,,
AvalonMeta,Edtech,,420000.0,,,2020,2017.0,,"Varun Mayya, Shashank Udupa, Abhinav Arora",Peerplays,It combines higher education and competitive gaming,,
Near Store,Ecommerce,Seed Round,300000.0,,,2020,,Mumbai,,Sauce.vc,Enables a shop to create an online presence,,
ElecTorq,Automobile,,,,,2020,,Delhi,Anubhav Sharma,AdvantEdge,Electric vehicle startup,,
Prayaan Capital,Fintech,Seed Round,1200000.0,,,2020,,Chennai,"Madhan Mohan , Akash Chelvam",Accion Venture Lab,"NBFC that lends to micro, small, and medium-sized enterprises (MSMEs)",,
Sanfe,Hygiene,Pre series A,1100000.0,,,2020,,Delhi,"Archit Agarwal, Harry Sehrawat","SucSEED Venture Partners, BIRAC, Elixir Pharma, Titan Capital",Women health care and wellness product,,
Go Desi,Foodtech,Seed Round,627300.0,,,2020,2018.0,Delhi,Vinay Kothari,Rukam Capital,Provides traditional delicacies,,
Swiggy,Foodtech,Series A,113000000.0,,,2020,2014.0,Bangalore,"Nandan Reddy, Sriharsha Majety, Rahul Jaimini",Prosus N.V,Platform to order food online from restaurants and getting it delievered,,
Whatfix,SaaS,Series C,32000000.0,,,2020,2014.0,Banglore,"Khadim Batti, Vara Kumar",Sequoia Capital India,"Digital adoption platform that helps companies provide intuitive onboarding, training and support",,
Unacademy,Edtech,Series E,110000000.0,,,2020,2010.0,Bangalore,"Gaurav Munjal, Roman Saini, Hemesh Singh","Facebook, General Atlantic, Sequoia India, Nexus Venture Partners, Steadview Capital, Blume Ventures",Platform that offers online education in India,,
Zvesta,Proptech,,5500000.0,,,2020,2015.0,Gurugram,"Rajan Dang, Anushree Srivastava",Hindustan Media Ventures,An online platform where users can search and buy properties listed by developers and brokers,,
Dunzo,Logistics,,11000000.0,,,2020,2014.0,Bangalore,Kabeer Biswas,Alteria Capital,India-based hyperlocal delivery startup,,
Digit Insurance,Insurtech,,340000.0,,,2020,,Bangalore,Kamesh Goyal,"Virat Kohli, Anushka Sharma",General Insurance Company,,
Yolo,Transport,Seed funding,600000.0,,,2020,2019.0,Gurugram,"Shailesh Gupta, Mukul Shah, Danish Chopra",Undisclosed,Intercity transportation,,
SmartVizX,VR & SaaS,Pre series A,1397000.0,,,2020,2015.0,,"Tithi Tewari, Gautam Tewari",Rockstud Capital,It developed India’s first VR-based design communication and collaboration product Trezi,,
MaxWholesale,Ecommerce,Series A,3000000.0,,,2020,2016.0,Delhi,Samarth Agrawal,"IAN Fund-I,  Al Falaj Investment Company (AFI)",B2B ecommerce platform for kirana stores,,
Carbon Clean,Cleantech,,16000000.0,,,2020,2009.0,,"Aniruddha Sharma, Prateek Bumb","WAVE Equity Partners, Chevron Technology Ventures, Marubeni Corporation.",Develops affordable carbon capture technology,,
Onsitego,Sales & Services,Series B,19000000.0,,,2020,,,Mahipal,Zodius Growth Fund,It offers post-purchase services through a network of brand authorised service centres throughout the country,,
Genius Corner,Edtech,,250000.0,,,2020,2014.0,Noida,"Vishal Khatter, Dheeraj Khatter, Dipak Varshney","Mahesh Mohta, Jyoti Arora, Nachu Subramanian, Srivats",Framework to enable personalised learning using artificial intelligence (AI) and machine learning (ML).,,
PlanetSpark,Edtech,,448500.0,,,2020,2016.0,Gurugram,"Maneesh Dhooper, Kunal Malik","Indian Angel Network, Lead Angels, Hyderabad Angels",Provides neighbourhood learning zones where children learn and develop 'new-age' skills under one roof,,
CamCom,AI & Deep learning,,,,,2020,2017.0,Bangalore,"Ajith Nayar, Umesh, Mahesh Subramanian","Triton Investment Advisors,",AI automation platform for enterprise quality control,,
Simsim,Social Commerce,Series B,8000000.0,,,2020,,Bangalore,Amit Bagaria,"Accel Partners, Shunwei Capital, Good Capital",It enables community opinion influencers to sell products to thousands of micro-communities in India,,
Shuttl,Transport,Series C,7975700.0,,,2020,2015.0,Delhi,"Amit Singh, Deepanshu Malviya",SIG Global India Fund,App based bus aggregator serice,,
HooLiv,Housing & Rentals,,,,,2020,,Delhi,"Chinmoy Mishra, Gaurav Vij, and Abhishek Verma",Kolte-Patil Family Office,Student Co-living startup,,
ClassMonitor,Edtech,,,,,2020,,Indore,"Vijeet Pandey, Vikas Rishishwar",Ashwin Khorana,The learning platform that blends curriculum-based activities for children,,
Friyey,Co-working,,,,,2020,,Pune,Yogesh Thore,Tarun Bhalla,Co working space startup,,
Oga,Fitness,,330000.0,,,2020,,Bangalore,Ashish Rawat,Inflection Point Ventures,Provides interactive fitness experience to people across the world,,
Big Basket,Estore,,3500000.0,,,2020,,Bangalore,"Abhinay Choudhari, Hari Menon, Vipul Parekh, VS Sudhakar",Trifecta Capital,Online grocery store,,
CYFIRMA,SaaS,Series A,,,,2020,,Bangalore,Ritesh Kumar,Z3 Partners,Offer cybersecurity services,,
Innoviti,,,5000000.0,,,2020,,Bangalore,Rajeev Agrawal,FMO,Digital payments solutions company,,
Paytm money,Fintech,,5600000.0,,,2020,2010.0,Bangalore,Vijay Shekhar Sharma,One97 Communications,Wealth Management,,
Vedantu,Edtech,Series C,24000000.0,,,2020,,Bangalore,"Saurabh Saxena, Pulkit Jain, Anand Prakash, Vamsi Krishna",GGV Capital,Onine learning platform,,
Yap,Fintech,,1402000.0,,,2020,,Chennai,"Madhusudanan R, Muthukumar and Prabhu","Amrish Rau, Kunal Shah, Jitendra Gupta",Banking and payment products-focused API platform,,
Clover,Agritech,Series A,5500000.0,,,2020,,Bangalore,"Avinash BR, Gururaj Rao, Arvind Murali, Santhosh Narasipura","Omnivore, Accel Partners, Mayfield",Provides agricultural solution to farmers working in the greenhouse production of vegetables and fruits,,
Nova Credit,Fintech,Series B,50000000.0,,,2020,,,Nicky Goulimis,"Kleiner Perkins, Canapi Ventures, Index Ventures, Nyca Partners, General Catalyst.",Cross-border consumer credit startup,,
CodingNinjas,Edtech,Series A,5200000.0,,,2020,2016.0,Delhi,"Singla, Kannu Mittal, Dhawal Parate",Info Edge Ltd,Online learning platform,,
Furlenco,Ecommerce,Series C,2200000.0,,,2020,2011.0,Bangalore,Ajith Mohan Karimpana,Chowdry Associates,Furniture rental startup,,
Brick&Bolt,,Pre series A,1500000.0,,,2020,2018.0,Bangalore,"Jayesh Rajpurohit, Arpit Rajpurohit",Surge,Operates in the residential construction space,,
HempStreet,Healthtech,Pre series A,1000000.0,,,2020,2019.0,,Abhishek Mohan,Pharmacon Holdings,Manufacturer of ayurvedic medicines based on cannabis,,
MoEngage,Marketing,Series C,25000000.0,,,2020,,Bangalore,"Raviteja Dodda, Yashwanth Kumar",Eight Roads Ventures,Customer analytics and cross-channel engagement platform,,
Classplus,Edtech,Pre series A,2500000.0,,,2020,2018.0,,"Rustagi, Bhaswat Agarwal","Blume Ventures, Sequoia",It allows coaching centres to take their brick-and-mortar setup online,,
Chaayos,Beverages,,21500000.0,,,2020,2012.0,,"Nitin Saluja, Raghav Verma",Think Investment,Provides customised range of tea,,
PetPooja,SaaS,,2000000.0,,,2020,2011.0,Ahmedabad,Apurv Patel,Udaan,Restaurant management software provider,,
Altor,Tech,,,,,2020,,,"Shamik Guha, Sayan Tapadar, Muhammad Bilal Shakil, Anirban Datta Gupta",Venture Catalysts,Makes helmets that are IoT and AI enabled,,
Pepperfry,E-market,Series F,40000000.0,,,2020,2013.0,Mumbai,"Ambareesh Murty, Ashish Shah",Pidilite Industries,Online home furniture marketplace,,
FirstCry,E-market,Series E,296000000.0,,,2020,2010.0,Pune,"Supam Maheshwari, Amitava Saha",Softbank’s Vision Fund,Baby products marketplace,,
Byju,Edtech,,200000000.0,,,2020,2011.0,,Byju Raveendran,General Atlantic,Provides online learning classes,,
Waycool,Agritech,Series C,32000000.0,,,2020,2015.0,Chennai,Karthick Jayraman and Sanjay Dasari,LightBox Ventures,Food development and distribution services,,
WorkIndia,HR tech,,6000000.0,,,2020,,,Kunal Patil,Xiaomi,An online and mobile-based platform that connects companies with blue collar employees.,,
Qyuki,Media,,3500000.0,,,2020,,Mumbai,"AR Rahman, Shekhar Kapur",Info Edge Venture Fund,Multi-channel broadcast network,,
Leap India,Agritech,Series B,30000000.0,,,2020,,Coimbatore,Narain Karthikeyan.,Neev Fund,Agricultural warehousing and logistics company,,
Picxy,Media,,250000.0,,,2020,,Hyderabad,Jitendra Emmani,"FirstCheque, Angellist India, Aakrit Vaish, Ranjith Radhakrishnan",Stock photo industry,,
Krimanshi,Agritech,,20000.0,,,2020,,Jodhpur,Nikhil Bohra,Arunachal Pradesh Social Entrepreneurship Meet,Sustainable system to feed animals by valorizing food residues and surplus into highly nutritious feeds,,
NEETprep,Edtech,,,,,2020,,Delhi,Kapil Gupta,IndiaQuotient,Provides crash course for NEET preparation,,
Dot Pvt. Ltd,Fintech,Seed Round,8000000.0,,,2020,,Gurugram,Shailaz Nag,"PayU, Fosun RZ Capital",It provides digital transformation and commerce solutions to brick and mortar outlets,,
Kuku FM,Media,Series A,5500000.0,,,2020,,Mumbai,"Lal Chand Bisu, Vikas Goyal, Vinod Kumar Meena",Vertex Ventures,A podcast platform,,
SuperMoney,Fintech,Pre series A,1000000.0,,,2020,2018.0,Mumbai,Nikhil Banerjee,Unitus Ventures.,Provides financial tools for effective business making,,
Rebel Foods,Food tech,,4900000.0,,,2020,,,"Jaydeep Barman, Kallol Bannerjee",Alteria Capital,It runs internet kitchen,,
AlphaVector,E tailor,,,,,2020,2015.0,Bangalore,Sachin Chopra,"Avaana Capital, Titan Capital",It sells modern age bicycles named FROG,,
Fox Capital,Fintech,,2500000.0,,,2020,2019.0,Jaipur,Rakesh Sharma,Institutional Investors,Digital lending startup,,
Tribe Theory,Accomodation,,3500000.0,,,2020,,Bangalore,Katie Russel and Daniel Wiegand,Tim Draper,An entrepreneur-focused hostel chain present in multiple locations across the world.,,
Fleetx,SaaS,Series A,1402400.0,,,2020,,,"Vineet Sharma, Abhay Jeet Gupta, Udbhav Rai, Parveen Kataria, Vishal Misra",Beenext,Fleet management and predictive analytics platform,,
Embibe,Edtech,,12618300.0,,,2020,,Mumbai,Aditi Avasthi,Reliance Industries Limited (RIL),It provides AI-based data analytics to personalise learning outcomes,,
Entri,Edtech,Seed Round,1400000.0,,,2020,2017.0,Kochi,"Mohammed Hisamuddin, Rahul Ramesh",Good Capital,It is a app that provides different types of learning content in local languages,,
Oye! Rickshaw,E-mobility,Series A,10000000.0,,,2020,,,Akash Deep,Chiratae Ventures,App-based electric rickshaw hailing service,,
Seal Professional,Edtech,Pre series A,,,,2020,2012.0,Bangalore,,Equanimity Ventures,Trains students in managemnt and leadership skills and also helps in placement,,
Sprinng Foods,Food,,,,,2020,,Mumbai,Tarun Khanna,"Mistletoe, Info Edge Asia",Provides Gluten-free food,,
1MG,Healthtech,,9900000.0,,,2020,2015.0,Gurugram,"Prashant Tandon, Gaurav Agarwal, Vikas Chauhan",Bill & Melinda Gates Foundation,Online pharmacy,,
Aagey,Fintech,,,,,2020,,Bangalore,Akaash Shankar,"JITO Angel Network, Ketan Kothari, Girish Jain, Sunil Singhvi, Vinay Jain",Provides financial assistance to MSMEs,,
Doubtnut,Edtech,Series A,15000000.0,,,2020,2017.0,Gurugram,"Tanushri Nagori, Aditya Shankar",Tencent,Multi-lingual digital solutions platform for students,,
AdonMo,Ad-tech,,3000000.0,,,2020,2017.0,Bangalore,"Sandeep Bommireddi, Sravanth Gajula",Ant Financial,It is an online and outdoor advertising company,,
RACEnergy,E-mobility,Seed Round,,,,2020,2018.0,,"Arun Sreyas, Gautham Maheswaran","GrowX ventures, Prophetic Ventures",It builds electric vehicles and supporting infrastructure,,
BharatPe,Fintech,,100000000.0,,,2020,2018.0,Delhi,Ashneer Grover,Coatue Management,Digital payments platform,,
Kisan Network,Agritech,Seed Round,3000000.0,,,2020,2015.0,Gurugram,"Aditya Agarwalla, Sanjay Agarwalla",Atsushi Taira,Integrated supply chain for farmers to sell their produce directly to buyers,,
Vogo,Automotive,Series C,35000000.0,,,2020,2016.0,Bangalore,"Anand Ayyadurai, Padmanabhan Balakrishnan, Sanchit Mittal",Lightstone Aspada,A scooter-sharing platform allowing users to rent a two-wheeler from specific designated pick up points,,
Yolo,Transport,Seed Round,600000.0,,,2020,2019.0,Gurugram,"Shailesh Gupta, Mukul Shah, Danish Chopra",Undisclosed,Intercity transportation startup,,
Unotech,SaaS,,2000000.0,,,2020,2011.0,Mumbai,Vikash Jha,Manish Choksi,It develops fully-customisable open source software,,
Zetwerk,Marketplace,,2200000.0,,,2020,2018.0,Bangalore,"Amrit Acharya, Srinath Ramakkrushnan, Vishal Chaudhary",InnoVen capital,B2B marketplace that connects manufacturing companies for industrial equipements,,
CureSkin,Healthtech,,500000.0,,,2020,2017.0,Bangalore,"Guna Kakulapati, Rama Rajanna, Charu Sharma",SenseAI Ventures,Provides a treatment solution for skincare and hair fall issues with an artificial intelligence-enabled solution,,
WizKlub,Edtech,Seed Funding,982530.0,,,2020,2018.0,Bangalore,Amit Bansal,Incubate Fund India,Helps students solve problems at complex level,,
Interviewbit,Edtech,Series A,200000000.0,,,2020,2014.0,Pune,Abhimanyu Saxena,"Tiger Global Management, Sequoia Capital India, Singapore’s Economic Development Board (EBD)",Platform that provides coding and interview preparation course by industry professionals from tech companies,,
MoneyTap,Fintech,Series B,70185200.0,,,2020,2016.0,,"Bala Parthasarathy, Anuj Kacker, Kunal Varma","Aquiline Technology Growth (ATG), RTP Global, Sequoia India",App-based consumer credit line that gives customers access to credit on tap.,,
Uniplatform Tech,SaaS,,,,,2020,2015.0,Delhi,"Rohit Manghnani, Amit K Jaiswal, Iccha Manghnani","Frontline Strategy Finds, SucSEED Venture Partners LLP",Runs real estate SaaS platform MultiplyMyLeads.com.,,
INdwealth,Fintech,Series C,12000000.0,,,2020,,Gurugram,Ashish Kashyap,"Tiger Global, Steadview Capital, DF International Private Partners",An Artificial Intelligence and Machine learning based wealth management platform,,
Bizongo,Marketplace,Series C,30000000.0,,,2020,2015.0,Mumbai,"Sachin Agarwal, Aniket Deb, Ankit Tomar",Schroder Adveq,A B2B marketplace for packaging materials,,
AppsFlyer,SaaS,Series D,210000000.0,,,2020,2011.0,Bangalore,"Oren Kaniel, Reshef Mann",General Atlantic,Mobile marketing analytics and attribution platform,,
Digit Insurance,Insurtech,,84000000.0,,,2020,,Bangalore,Kamesh Goyal,"A91 Partners, Faering Capital, TVS Capital",General Insurance Company,,
Livspace,Interior Design,Series D,60000000.0,,,2020,2014.0,Bangalore,"Anuj Srivastava, Ramakant Sharma, Shagufta Anurag","Tahoe Investment Group, Mercer Investment",It offers end-to-end home design experience for homeowners and home designers,,
GetVantage,Fintech,Seed Round,,,,2020,,Mumbai,Bhavik Vasa,"Samyakth Capital, Venture Catalysts",Revenue based finance provider,,
Konfinity,Edtech,,,,,2020,2018.0,Noida,"Navratn Singh, Kamal Pandey",Angel investors,Provides online coding courses,,
Pine Labs,Fintech,,,,,2020,,Noida,"Lokvir Kapoor, Rajul Garg, Tarun Upaday",Mastercard,Retail payment and hardware company,,
Instoried,SaaS,,,,,2020,,Delhi,Sharmin Ali,"SOSV, Chinaccelerator",Augmented writing platform which improves customer interest and engagement.,,
Nupay,Neo-banking,,,,,2020,,Haryana,"Neeraj Singh, Alok Arora",Venture Catalysts,"Integrated platform for Receivables and Payables automation, Electronic Invoicing, Reconciliations and Bank payouts",,
LogiNext,Transport Automation,Series B,39000000.0,,,2020,,,"Dhruvil Sanghvi, Manisha Raisinghani","Tiger Global, Steadview Capital","It helps logistics companies to improve internal operations, optimise delivery networks and provide customer service",,
Samosa Singh,Food,Series A,2700000.0,,,2020,2016.0,Bangalore,"Shikhar Veer Singh, Nidhi Singh",She Capital,Offers hygienic Indian Snacks,,
Crysta,Healthtech,Pre Series A,1403400.0,,,2020,2018.0,Delhi,,"Green Shots Capital, Alfa Ventures, Real Time Venture, Petrotech, Steel City Securities, Lalit Wadhwa, Dr Kriti Maroli",Offers diagnostic and screening services with regular counselling and clinical data management,,
Eupheus Learning,Edtech,Series A,4300000.0,,,2020,2017.0,New Delhi,"Sarvesh Shrivastava, Ved Prakash Khatri, Amit Kapoor",Yuj Ventures,"Provides technology-led, subscription-based learning solutions to schools",,
Bounce,Automotive and Rentals,Series D,105000000.0,,,2020,2014.0,Bangalore,"Vivekananda Hallekere, Anil Giri Raju,Arun Agni","Accel Partners, B Capital",Offers a variety of bikes and scooters that can be rented on a subscription basis,,
Park+,Techonology,,11000000.0,,,2020,,,Amit Lakhotia,"Sequoia Capital, Matrix Partners India",It is engaged in bringing digitization in parking,,
Goodmylk,Dairy,Seed Round,400000.0,,,2020,2017.0,Bangalore,Abhay Rangan,"Ginni International, Elisa Khong, Sandeep Singh, VegInvest",Provides Vegan dairy products,,
SmartKarrot,SaaS,,1000000.0,,,2020,2019.0,,"Prithwi Dasgupta, Arnab Chatterjee",Angel investors,It tracks customers’ real-time digital behaviour,,
Skylo,IoT,Series B,103000000.0,,,2020,2017.0,,Trivedi,SoftBank Group,Provides affordable and ever present network that connects machines or sensors,,
Tea Trunk,Beverage,,220000.0,,,2020,2013.0,Goa,"Snigdha Manchanda, Vikas Kumar, Aishwarya Malhi",Angel investors,Global premium tea brand,,
Zoomcar,Transport & Rentals,Series D,30000000.0,,,2020,2013.0,Bangalore,"Greg Moran, David Back",Sony Innovation Fund,A car rental service platform,,
Mera Cashier,Fintech,Seed Round,250000.0,,,2020,2019.0,Noida,"Suneel Kumar, Sucharita Reddy, Gaurav Tomar, Akhilesh Nigam,","Amit Singal, Manish Aggarwal",App meant for small and micro businessmen to manage their transactions digitally,,
Samya AI,SaaS,Seed Round,6000000.0,,,2020,2019.0,,"Shailendra Singh, Deepinder Dhingra, Pavan Palety",Sequoia India,Revenue growth AI startup in the consumer packed goods (CPG) space,,
Kristal AI,AI,Series A,6000000.0,,,2020,2016.0,,"Asheesh Chanda, Vineeth Narasimhan",Chiratae Ventures,Provides Algorithm-based financial services,,
Invento Robotics,AI Robotics,Seed Round,281300.0,,,2020,,,"Balaji Viswanathan, Be Limitless Inc., Zingfin.com, NalandaU","Windrose Capital, ITI Growth Opportunities Venture Fund",Known for Mitra Series of Robots,,
Zimyo,HR tech,,,,,2020,2018.0,Gurugram,"Kumar Mayank, Ajay Kadyan",Yatra Angel Network (YAN),Automates everyday HR processes with integrated solutions,,
Sabse Sasta Dukaan,Pharmaceutical,,,,,2020,2016.0,Kolkata,"Anish Agarwal, Anant Jain",Angel investors,Online pharmacy dealing in medicines,,
Fitphilia,Healthtech,,,,,2020,,Mumbai,Nirav Patil,Angel investors,Provides IoT-enabled treadmill,,
Medicus,Healthtech,,12700.0,,,2020,,Mumbai,"Bhavesh Shah, Manav Shah",Angel investors,AI-based platform that explains and interprets blood tests and medical reports,,
Monech,Fintech,Seed Round,12700.0,,,2020,,Mumbai,,Angel investors,Automated platform which will help users to take their financial decisions,,
Teach Us,Edtech,Seed Round,12700.0,,,2020,,,,Angel investors,Educational portal which enables the students to access information related to education at one common platform,,
Dealberg,B2B marketplace,,,,,2020,,Bangalore,Abhishek Emmanuel,Undisclosed,Deals in office supplies,,
Phenom People,HR tech,Series C,30000000.0,,,2020,2010.0,,Mahe Bayireddi,WestBridge Capital,It redefines the means to search for a job and recruit top talent,,
Extra Edge,Edtech,Pre Series A,700000.0,,,2020,,Pune,Kavita Dhillon,"Sprout Venture Partners, Indian Angel Network",Admission Marketing Automation software for the education industry,,
Capital Quotient,Fintech,,600000.0,,,2020,2016.0,Bangalore,Sousthav Chakrabarty,Undisclosed,Investment advisor,,
Karfa,Ecommerce,Seed Round,25000.0,,,2020,,Delhi,Kartikeya Goel,Undisclosed,It sells products crafted by artisans,,
Gamerji,Gaming,,400000.0,,,2020,2019.0,,"Soham Thacker, Varun Gajjar",La Gajjar Group,Esports tournament platform,,
Bounce,Automotive and Rentals,Series D,97500000.0,,,2020,2014.0,Bangalore,"Vivekananda Hallekere, Anil Giri Raju,Arun Agni","Accel Partners, B Capital",Offers a variety of bikes and scooters that can be rented on a subscription basis,,
Zinier,Automation,Series C,90000000.0,,,2020,2015.0,Bangalore,Arka Dhar,ICONIQ Capital,Provides intelligent field service automation,,
ProEves,Preschool Daycare,Seed Round,507000.0,,,2020,2016.0,Delhi,"Divya Agarwal, Ketika Kapoor",1Crowd,"Provides tech-enabled, end-to-end childcare support solutions for corporate and retail consumers",,
Toddle,,,,,,2020,,Bengaluru,"Deepanshu Arora, Parita Parekh",Matrix Partners India,Collaboration and productivity platform for teachers across the world,,
Aesthetic Nutrition,Food diet,Pre Series A,,,,2020,2018.0,,Divij Bajaj,DSG Consumer Partners,Markets and sells chewable dietary supplements,,
Capital Float,Fintech,,15000000.0,,,2020,2013.0,Bangalore,"Gaurav Hinduja, Sashank Rishyasringa","Sequoia Capital, Ribbit Capital, Amazon, Saif Partners",Digital lending,,
Ninjacart,B2B Agritech,Series C,10000000.0,,,2020,2015.0,Bangalore,"Thirukumaran Nagarajan, Sharath Loganathan, Sachin Jose, Kartheeswaran KK, Vasudevan Chinnathambi","Flipkart India, Singapore-based GEC3",Online grocery delivery platform,,
TechnifyBiz,B2B Agritech,Seed Round,2000000.0,,,2020,2017.0,,"Akash Sharma, Abhishek Agarwal","Omnivore, Insitor Impact Asia Fund",Online marketplace for non-perishable food items,,
Wysh,E-connect,Series A,2000000.0,,,2020,2019.0,Hyderabad,"Mahesh Gogineni, Varun MS, Manan Maheshwari",Kalaari Capital,Celebrity engagement and wishing platform,,
Keito,AI,Seed Round,160000.0,,,2020,2016.0,Pune,Amal PS,Suma Soft Pvt Ltd,Enterprise productivity startup,,
Klub,Fintech,Pre seed round,2000000.0,,,2020,2019.0,,"Anurakt Jain, Ishita Verma",Sequoia Surge,Provides growth financing to high-affinity brands,,
Aadhar,Ecommerce,Seed Round,,,,2020,2017.0,Mumbai,,"Sprout Venture Partners, JITO Angel Network, LetsVenture",Ayurveda wellness and lifestyle consumer brand,,
IncubateHub,Tech hub,,,,,2020,,Bengaluru,Rajiv Mukherjee,Venture Catalysts,Provides platform for Corporates to connect establish brand presence among innovation community,,
Rage Coffee,FMCG,,,,,2020,,Delhi,Bharat Sethi,Refex Capital,Provides effective Instant Coffee Infused with Natural Brain Vitamins & Plant Based Cognitive Enhancers,,
Skilancer,Technology,,,,,2020,,Noida,Neeraj Kumar,Venture Catalysts,Solar module cleaning system [MCS] providers,,
Harappa Education,Edtech,,,,,2020,,New Delhi,Pramath Raj Sinha,James Murdoch-led Lupa Systems,Provides online courses on foundational skills,,
Rheo,Entertainment,,2000000.0,,,2020,,,Gaurav Munjal,"Lightspeed Venture Partners, Sequoia Surge",Online e-sports streaming and community platform,,
Axio Biosolutions,Medtech,Series B,5200000.0,,,2020,,Bangalore,Leo Mavely,Omidyar Network India,Medical device manufacturer,,
Techbooze,Consultancy,Series A,15000000.0,,,2020,,,Mr. Subhashis Kar,Space Capital,"Business Development, Consulting and Funding facilitator for Startups Enterprise",,
PayMart,Fintech,,,,,2020,2015.0,Chandigarh,Amit Narang,"IIM Ahmedabad’s incubator (CIIE.CO),Chandigarh Angels Network",Provides cardless cash withdrawals through small merchants shops,,
Testbook,Edtech,Series B,8400000.0,,,2020,,,"Praveen Agrawal, Yadvendar Champawat, Manoj Munna, Abhishek Sagar, Ashutosh Kumar, Narendra Agrawal",Iron Pillar,Helps students prepare online for competitive exams,,
FabAlley,Ecommerce,,1100000.0,,,2020,2012.0,Noida,"Tanvi Malik, Shivani Poddar.",Trifecta Capital,Online fashion store,,
HaikuJAM,,,3400000.0,,,2020,,,Neer Sharma,"Lightbox. Social Capital, Dunce Capital",Creative writing mobile platform,,
Mamaearth,Ecommerce,Series A,18300000.0,,,2020,,,"Ghazal Alagh, Varun Alagh",Sequoia India,Online baby and mother care brand,,
Rentomojo,Rental,,2000000.0,,,2020,2014.0,,Geetansh Bamania,GMO Payment Gateway,"Furniture, electronics, and appliance-centric consumer leasing platform",,
Zomato,Foodtech,,150000000.0,,,2020,,,Deepinder Goyal,Ant Financial,Online food delivery and restaurant discovery platform,,
Byju,Edtech,,200000000.0,,,2020,2011.0,,Byju Raveendran,Tiger Global,Provides online learning classes,,
Generico,Pharmacy,,1400000.0,,,2020,,Mumbai,Siddharth Gadia,Alteria Capital,Generic medicine focussed retail chain,,
HighRadius,SaaS,Series B,125000000.0,,,2020,2016.0,Hyderabad,Sashi Narahari,ICONIQ Capital,"An AI-based platform, to automate accounts receivables and treasury processes.",,
Chai Kings,Beverage,,1000000.0,,,2020,,Chennai,"Jahabar Sadique, Balaji Sadagopan",The Chennai Angels (TCA),It offers a range of tea in various flavour,,
Rivigo,Logistics,Series F,3400000.0,,,2020,2014.0,Gurugram,"Deepak Garg, Gazal Kalra",Trifecta Capital,"It offers delivery services across India to retail, e-commerce, pharmaceutical, automobile and FMCG companies",,
BuildPan,SaaS,Seed Round,,,,2020,2019.0,Indore,"Sonal Khandelwal, Vaibhav Tiwari","HNIs in India, Japan, and the US","It helps developers to test, integrate and deploy apps",,
Shiksha,Edtech,,181000.0,,,2020,2008.0,,Kanav Sachdeva,Mumbai Angels Network,It makes college selection easy for students looking to pursue UG and PG courses in India and abroad,,
Super Surfaces,Deisgning,Series A,500000.0,,,2020,,Hyderabad,Kumar Varma,Vishnu Reddy,A design solution based company,,
Quicko,Taxation,,280000.0,,,2020,,Ahmedabad,Vishvajit Sonagara,"Zerodha fintech fund, Rainmatter",Online tax planning and filing platform,,
Satin Creditcare,Fintech,,15000000.0,,,2020,,Gurgaon,,Austrian Bank,A micro finance company,,
XpressBees,Logistics,,10000000.0,,,2020,2015.0,,"Supam Maheshwari, Amitava Saha",Alibaba,Provides end to end supply chain solutions,,
FarmERP,Agritech,Series A,,,,2020,2001.0,Pune,"Santosh Shinde, Sanjay Borkar",TechnoGen,Smart agriculture management ERP software platform,,
